{
  "schemaVersion": 1,
  "reportId": "INTC",
  "revision": "intc-initial-20260731-r2",
  "status": "published",
  "renderMode": "structured",
  "templateVersion": "sim-report-v1",
  "update": {
    "mode": "initial",
    "baseRevision": null,
    "reason": "Intel Corporationの新規企業ガイドと株価シナリオを、Q2 2026決算・最新SEC提出・市場データに基づいて作成",
    "changedFields": [
      "overview",
      "guide",
      "scenario",
      "sources",
      "validation"
    ]
  },
  "meta": {
    "companyName": "Intel Corporation",
    "ticker": "INTC",
    "aliases": [
      "Intel",
      "インテル"
    ],
    "market": "US",
    "exchange": "NASDAQ",
    "currency": "USD",
    "valuationDate": "2026-07-30",
    "lastUpdated": "2026-07-31",
    "sector": "半導体・AIコンピューティング",
    "industry": "CPU・データセンター半導体・半導体ファウンドリー",
    "fiscalYearLabel": "FY2026",
    "marketDetails": {
      "reportingStandard": "US-GAAP",
      "secCik": "50863",
      "adr": false,
      "fiscalYearEndMonth": 12
    }
  },
  "overview": {
    "tagline": "PCとサーバー向けCPUの収益力に、米国先端ファウンドリー再建の成否が重なる大型ターンアラウンド銘柄。",
    "heroTags": [
      "CPU",
      "AIデータセンター",
      "Intel 18A",
      "米国製造"
    ],
    "heroStats": [
      {
        "value": 91.13,
        "label": "現在株価",
        "note": "2026-07-30米国市場終値",
        "tone": "normal",
        "livePrice": true
      },
      {
        "value": "$16.1B",
        "label": "Q2 2026売上",
        "note": "前年比25%増・US-GAAP",
        "tone": "up"
      },
      {
        "value": "40.4%",
        "label": "Q2 GAAP粗利率",
        "note": "前年同期比12.9ポイント改善",
        "tone": "up"
      },
      {
        "value": "-$2.09B",
        "label": "Q2 Foundry営業損益",
        "note": "内部取引を含むセグメント値",
        "tone": "down"
      }
    ],
    "businessSummary": "IntelはCPUやカスタム半導体を設計するIntel Productsと、先端プロセス・製造・先端パッケージを担うIntel Foundryを同じ企業内に持つIDMです。Q2 2026はPC向けのCCPGが88.77億ドル、データセンター・AIのDCAIが62.62億ドルと製品部門が伸び、連結売上は161.28億ドルでした。評価の焦点は、製品利益の回復を維持しながら、Intel 18Aの歩留まり・供給量・外部顧客を増やし、Foundryの巨額赤字と資本負担を縮小できるかです。"
  },
  "guide": {
    "sections": [
      {
        "id": "company",
        "topic": "company",
        "icon": "🏢",
        "title": "Intelは何で稼ぐ会社？",
        "subtitle": "設計と製造を一体で持つIDM",
        "summaryItems": [
          "PC・サーバー向けCPUが製品利益の中心",
          "Foundryは社内製造が大半で、外部顧客獲得はまだ育成段階",
          "製品の回復と工場の採算改善を同時に進める必要がある"
        ],
        "blocks": [
          {
            "type": "paragraphs",
            "title": "会社の全体像",
            "paragraphs": [
              "Intel Productsは、PC・エッジ向けのClient Computing and Physical AI Groupと、サーバーCPU・ネットワーク・カスタムASICなどを扱うData Center and AIで構成されます。Q2 2026のIntel Products売上は151.39億ドル、営業利益は48.17億ドルで、連結利益を支える中核でした。",
              "Intel Foundryはプロセス開発、ウェハ製造、組立・テスト、先端パッケージを提供します。ただし現時点では売上の大半がIntel社内向けです。Q2 2026のFoundry売上57.65億ドルに対して営業損失は20.89億ドルで、先端ノード立ち上げ費用と高コストのIntel 18Aウェハが採算を圧迫しています。",
              "Alteraは2025年9月に51%を売却して連結対象から外れました。このため前年同期との比較には事業構成の変化が含まれ、単純な売上比較だけで本業の成長率を判断しないことが重要です。"
            ],
            "sourceRefs": [
              "intc-q2-2026-ir",
              "intc-q2-2026-10q",
              "intc-2025-10k"
            ]
          },
          {
            "type": "facts",
            "title": "Q2 2026スナップショット",
            "items": [
              {
                "label": "連結売上",
                "value": "161.28億ドル"
              },
              {
                "label": "CCPG売上",
                "value": "88.77億ドル"
              },
              {
                "label": "DCAI売上",
                "value": "62.62億ドル"
              },
              {
                "label": "営業キャッシュフロー",
                "value": "Q2単独70億ドル"
              },
              {
                "label": "発行済株式",
                "value": "50.43億株（2026-06-27）"
              }
            ],
            "sourceRefs": [
              "intc-q2-2026-ir"
            ]
          }
        ]
      },
      {
        "id": "industry",
        "topic": "industry",
        "icon": "🏭",
        "title": "半導体業界の勝ち方",
        "subtitle": "設計性能・歩留まり・規模・顧客採用の掛け算",
        "summaryItems": [
          "高性能でも量産歩留まりが低ければ利益になりにくい",
          "CPUはソフト互換性と顧客基盤が強みになる",
          "Foundryは外部顧客の量産採用と工場稼働率が決定的"
        ],
        "blocks": [
          {
            "type": "keypoints",
            "title": "投資家が見る4つの軸",
            "items": [
              {
                "icon": "⚙️",
                "title": "製品競争力",
                "text": "性能、消費電力、総保有コスト、ソフトウェア互換性がPC・サーバーの採用を左右します。"
              },
              {
                "icon": "🔬",
                "title": "プロセス技術",
                "text": "Intel 18Aの歩留まりと性能が、自社製品の競争力と外部Foundry受注の両方へ波及します。"
              },
              {
                "icon": "📦",
                "title": "供給能力",
                "text": "需要があっても基板・メモリ・工場能力が不足すると出荷数量を増やせません。"
              },
              {
                "icon": "💵",
                "title": "資本効率",
                "text": "先端工場は巨額の設備投資を必要とするため、稼働率と外部売上が低い期間はフリーキャッシュフローを圧迫します。"
              }
            ],
            "sourceRefs": [
              "intc-2025-10k",
              "intc-q2-2026-10q"
            ]
          },
          {
            "type": "highlight",
            "title": "Intel固有の難しさ",
            "text": "製品部門にとって工場は差別化要因ですが、工場の固定費は需要変動時の重荷にもなります。Intel Productsの利益だけを見ると好調でも、Foundryの赤字と設備投資を合算した連結価値で判断する必要があります。",
            "sourceRefs": [
              "intc-2025-10k",
              "intc-q2-2026-10q"
            ]
          }
        ]
      },
      {
        "id": "products",
        "topic": "products",
        "icon": "🧩",
        "title": "主力製品と技術",
        "subtitle": "PC、データセンター、Foundryの3本柱",
        "summaryItems": [
          "Core UltraはPC・エッジ・Physical AIへ展開",
          "Xeon 6+はIntel 18Aを使うサーバー製品",
          "外部Foundryと先端パッケージは将来の追加価値"
        ],
        "blocks": [
          {
            "type": "products",
            "title": "製品マップ",
            "items": [
              {
                "symbol": "PC",
                "name": "Core / Core Ultra",
                "use": "ノートPC、デスクトップ、エッジAI、産業・ロボティクス"
              },
              {
                "symbol": "DC",
                "name": "Xeon",
                "use": "クラウド、企業サーバー、AI推論、HPC"
              },
              {
                "symbol": "ASIC",
                "name": "Purpose-built silicon",
                "use": "顧客用途に最適化したネットワーク・セキュリティ等の半導体"
              },
              {
                "symbol": "FAB",
                "name": "Intel Foundry",
                "use": "Intel 18A/3/4、先端パッケージ、組立・テスト"
              }
            ],
            "sourceRefs": [
              "intc-q2-2026-ir",
              "intc-2025-10k"
            ]
          },
          {
            "type": "table",
            "title": "Q2 2026の伸び方",
            "columns": [
              "区分",
              "売上",
              "前年比",
              "読み方"
            ],
            "rows": [
              [
                "CCPG",
                "88.77億ドル",
                "+13%",
                "ASP上昇が寄与、クライアント数量は減少"
              ],
              [
                "DCAI",
                "62.62億ドル",
                "+59%",
                "サーバーASP上昇とハイパースケーラー需要"
              ],
              [
                "Intel Foundry",
                "57.65億ドル",
                "+31%",
                "大半は社内取引、外部売上は2.93億ドル"
              ],
              [
                "連結",
                "161.28億ドル",
                "+25%",
                "社内取引54.77億ドルを消去後"
              ]
            ],
            "sourceRefs": [
              "intc-q2-2026-ir",
              "intc-q2-2026-10q"
            ]
          }
        ]
      },
      {
        "id": "operations",
        "topic": "operations",
        "icon": "🛠️",
        "title": "製造・財務で外せない論点",
        "subtitle": "18Aの立ち上げ、供給制約、負債",
        "summaryItems": [
          "18A量産の歩留まり改善が売上と粗利率の両方に効く",
          "現金・短期投資より債務が大きく、設備投資との両立が課題",
          "政府向けエスクロー株と条件付きワラントはGAAP損益・希薄化の読解を難しくする"
        ],
        "blocks": [
          {
            "type": "facts",
            "title": "2026年6月末の財務位置",
            "items": [
              {
                "label": "現金・現金同等物",
                "value": "128.74億ドル"
              },
              {
                "label": "短期投資",
                "value": "168.53億ドル"
              },
              {
                "label": "短期債務",
                "value": "19.88億ドル"
              },
              {
                "label": "長期債務",
                "value": "485.49億ドル"
              },
              {
                "label": "概算ネット債務",
                "value": "208.10億ドル"
              },
              {
                "label": "上期設備投資支出",
                "value": "61.92億ドル（通常区分）"
              }
            ],
            "sourceRefs": [
              "intc-q2-2026-ir",
              "intc-q2-2026-10q"
            ]
          },
          {
            "type": "paragraphs",
            "title": "GAAP赤字をそのまま本業赤字と見ない",
            "paragraphs": [
              "Q2 2026のIntel帰属GAAP純損失は110.33億ドルでしたが、主因には米国政府向けエスクロー株の株価上昇に伴う125億ドルの時価評価損が含まれます。これは営業キャッシュフローと同じ動きをする費用ではありません。",
              "一方で非GAAPだけを見ればよいわけでもありません。Foundryの赤字、設備投資、株式報酬、政府向け株式の潜在希薄化、ApolloとのFab 34持分買い戻しに伴う資金負担は、企業価値に実際の影響を持ちます。米国政府向けには、IntelがFoundry事業の支配率51%以上を維持できなくなった場合に限り行使可能となる、最大2.41億株・行使価格20ドルの条件付きワラントもあります。現時点では行使可能でも行使見込みでもないため、通常の希薄化後株式数には加えていません。"
            ],
            "sourceRefs": [
              "intc-q2-2026-10q",
              "intc-apollo-2026-8k",
              "intc-2025-10k"
            ]
          }
        ]
      },
      {
        "id": "competition",
        "topic": "competition",
        "icon": "⚔️",
        "title": "競争相手と差別化",
        "subtitle": "製品会社とFoundryの二つの競争",
        "summaryItems": [
          "CPUではAMD、Arm系、顧客自社開発チップと競う",
          "AI計算ではGPU・アクセラレータ中心の投資配分が逆風になり得る",
          "FoundryではTSMC、Samsung等に対し、米国先端製造とIDM統合が差別化"
        ],
        "blocks": [
          {
            "type": "comparison",
            "title": "競争の見取り図",
            "columns": [